{
  "nutrition_transaction_version": "0.1",
  "transaction_id": "txn_example_001",
  "merchant": { "name": "Example Restaurant" },
  "purchased_at": "2026-08-09T19:00:00Z",
  "consumption_status": "purchased",
  "currency": "USD",
  "items": [
    {
      "id": "item_1",
      "name": "Hummus",
      "quantity": 1,
      "financial": { "unit_price": 5.99, "currency": "USD" },
      "nutrition": {
        "energy_kcal": 182,
        "protein_g": 7.9,
        "carbohydrate_g": 14.1,
        "total_fat_g": 10.2,
        "sodium_mg": 242
      },
      "nutrition_range": {
        "energy_kcal": { "min": 146, "max": 218 }
      },
      "nutrition_status": "estimated",
      "confidence": 0.7,
      "source_method": "recipe_calculation",
      "assumptions": ["Serving mass estimated at 100 g"],
      "provenance": [
        {
          "source_type": "usda_fdc",
          "source_id": "fdc:example",
          "source_name": "USDA FoodData Central",
          "ingredient_name": "hummus",
          "quantity_grams": 100
        }
      ]
    }
  ],
  "nutrition_total": {
    "energy_kcal": 182,
    "protein_g": 7.9,
    "carbohydrate_g": 14.1,
    "total_fat_g": 10.2,
    "sodium_mg": 242
  },
  "nutrition_total_range": {
    "energy_kcal": { "min": 146, "max": 218 }
  }
}
